[
  {
    "id": "src-casal-otero-ai-literacy-k12-review-2023",
    "title": "AI literacy in K-12: a systematic literature review",
    "authors": [
      "Lorena Casal-Otero",
      "Alejandro Catala",
      "Carmen Fernandez-Morante",
      "Maria Taboada",
      "Beatriz Cebreiro",
      "Senen Barro"
    ],
    "year": 2023,
    "doi": "10.1186/s40594-023-00418-7",
    "url": "https://doi.org/10.1186/s40594-023-00418-7",
    "openalex_id": null,
    "semantic_scholar_id": null,
    "eric_id": null,
    "publisher": "International Journal of STEM Education",
    "source_type": "systematic_review",
    "license": "CC BY 4.0",
    "abstract": "Systematic review of how AI literacy is being introduced in K-12. The authors analyze published interventions and frameworks and find that learners can develop AI literacy across conceptual, practical, and ethical dimensions, but that AI is rarely integrated as a structured part of the curriculum and that teacher preparation and assessment remain weak points.",
    "topics": [
      "ai literacy",
      "k-12",
      "education",
      "ethics"
    ],
    "status": "reviewed",
    "created_at": "2026-06-22",
    "reviewed_at": "2026-06-22"
  },
  {
    "id": "src-lee-developing-middle-school-ai-literacy-2021",
    "title": "Developing Middle School Students' AI Literacy",
    "authors": [
      "Irene Lee",
      "Safinah Ali",
      "Helen Zhang",
      "Daniella DiPaola",
      "Cynthia Breazeal"
    ],
    "year": 2021,
    "doi": "10.1145/3408877.3432513",
    "url": "https://doi.org/10.1145/3408877.3432513",
    "openalex_id": null,
    "semantic_scholar_id": null,
    "eric_id": null,
    "publisher": "ACM",
    "source_type": "peer_reviewed_article",
    "license": null,
    "abstract": "Reports the design and classroom implementation of a middle-school AI literacy curriculum. Following the curriculum, students were able to train and evaluate simple machine learning models, explain how training data shapes a model's behavior, and discuss the societal and ethical implications of AI systems they use.",
    "topics": [
      "ai literacy",
      "machine learning",
      "middle school",
      "curriculum"
    ],
    "status": "reviewed",
    "created_at": "2026-06-22",
    "reviewed_at": "2026-06-22"
  },
  {
    "id": "src-su-ai-literacy-early-childhood-2023",
    "title": "Artificial Intelligence (AI) literacy in early childhood education: The challenges and opportunities",
    "authors": [
      "Jiahong Su",
      "Davy Tsz Kit Ng",
      "Samuel Kai Wah Chu"
    ],
    "year": 2023,
    "doi": "10.1016/j.caeai.2023.100124",
    "url": "https://doi.org/10.1016/j.caeai.2023.100124",
    "openalex_id": null,
    "semantic_scholar_id": null,
    "eric_id": null,
    "publisher": "Computers and Education: Artificial Intelligence",
    "source_type": "conceptual_review",
    "license": null,
    "abstract": "Reviews opportunities and challenges of introducing AI literacy in early childhood education. Argues that young children can grasp age-appropriate AI concepts when teaching is concrete, playful, and embedded in familiar everyday contexts, while cautioning about developmental fit, teacher readiness, and the need for ethics-aware design.",
    "topics": [
      "ai literacy",
      "early childhood",
      "education"
    ],
    "status": "reviewed",
    "created_at": "2026-06-22",
    "reviewed_at": "2026-06-22"
  },
  {
    "id": "src-williams-young-children-ai-perceptions-2019",
    "title": "A is for Artificial Intelligence: The Impact of Artificial Intelligence Activities on Young Children's Perceptions of Robots",
    "authors": [
      "Randi Williams",
      "Hae Won Park",
      "Cynthia Breazeal"
    ],
    "year": 2019,
    "doi": "10.1145/3290605.3300677",
    "url": "https://doi.org/10.1145/3290605.3300677",
    "openalex_id": null,
    "semantic_scholar_id": null,
    "eric_id": null,
    "publisher": "ACM",
    "source_type": "peer_reviewed_article",
    "license": null,
    "abstract": "Empirical study of AI learning activities with young children. Hands-on activities measurably changed children's perceptions of intelligent agents, improving their ability to reason about what such systems can and cannot do and reducing naive anthropomorphic assumptions about robots and AI.",
    "topics": [
      "ai literacy",
      "early childhood",
      "robots",
      "education"
    ],
    "status": "reviewed",
    "created_at": "2026-06-22",
    "reviewed_at": "2026-06-22"
  },
  {
    "id": "src-druga-family-ai-literacy-2022",
    "title": "Family as a Third Space for AI Literacies: How do children and parents learn about AI together?",
    "authors": [
      "Stefania Druga",
      "Fee Lia Christoph",
      "Amy J. Ko"
    ],
    "year": 2022,
    "doi": "10.1145/3491102.3502031",
    "url": "https://doi.org/10.1145/3491102.3502031",
    "openalex_id": null,
    "semantic_scholar_id": null,
    "eric_id": null,
    "publisher": "ACM",
    "source_type": "peer_reviewed_article",
    "license": null,
    "abstract": "Study of children and parents learning about AI together at home. Through guided, social exploration of everyday smart devices, children developed algorithmic awareness - recognizing that such devices make data-driven decisions - and learned to question the behavior of the AI embedded in everyday tools.",
    "topics": [
      "ai literacy",
      "children",
      "algorithmic awareness"
    ],
    "status": "reviewed",
    "created_at": "2026-06-22",
    "reviewed_at": "2026-06-22"
  },
  {
    "id": "src-lo-chatgpt-education-review-2023",
    "title": "What Is the Impact of ChatGPT on Education? A Rapid Review of the Literature",
    "authors": [
      "Chung Kwan Lo"
    ],
    "year": 2023,
    "doi": "10.3390/educsci13040410",
    "url": "https://doi.org/10.3390/educsci13040410",
    "openalex_id": null,
    "semantic_scholar_id": null,
    "eric_id": null,
    "publisher": "Education Sciences",
    "source_type": "systematic_review",
    "license": "CC BY 4.0",
    "abstract": "Rapid review of early literature on ChatGPT in education. Finds clear potential to support teaching and learning alongside recurring concerns about inaccurate or fabricated output, over-reliance, and academic integrity, and stresses that learners need to verify AI-generated content against reliable sources.",
    "topics": [
      "generative ai",
      "chatgpt",
      "education",
      "critical thinking"
    ],
    "status": "reviewed",
    "created_at": "2026-06-22",
    "reviewed_at": "2026-06-22"
  }
]
